{
  "schema": "meduza.program/0.2-draft",
  "id": "count-only",
  "revision": 0,
  "mode": "fetch",
  "origin": {
    "kind": "read",
    "artifact_sha256": "0000000000000000000000000000000000000000000000000000000000000000",
    "decision_id": "fixture:d1"
  },
  "objective": {
    "id": "objective:fixture",
    "sha256": "1111111111111111111111111111111111111111111111111111111111111111"
  },
  "dependencies": [
    {
      "id": "fixture:catalog",
      "version": "1",
      "sha256": "2222222222222222222222222222222222222222222222222222222222222222"
    }
  ],
  "policy_ref": "policy:fixture",
  "parameters": {},
  "limits": {
    "max_steps": 100,
    "max_calls": 20,
    "max_wall_ms": 60000
  },
  "body": [
    {
      "id": "s1",
      "origins": [
        "point:p1"
      ],
      "op": "query",
      "capability": "lab.vm.count",
      "args": {},
      "bind": "total"
    },
    {
      "id": "s2",
      "origins": [
        "point:p1"
      ],
      "op": "publish",
      "value": {
        "ref": "total"
      }
    }
  ]
}
