{
  "schema": "meduza.program/0.2-draft",
  "id": "attach-set",
  "revision": 0,
  "mode": "achieve",
  "origin": {
    "kind": "read",
    "artifact_sha256": "0000000000000000000000000000000000000000000000000000000000000000",
    "decision_id": "fixture:d1"
  },
  "objective": {
    "id": "objective:fixture",
    "sha256": "1111111111111111111111111111111111111111111111111111111111111111"
  },
  "dependencies": [
    {
      "id": "fixture:catalog",
      "version": "1",
      "sha256": "2222222222222222222222222222222222222222222222222222222222222222"
    }
  ],
  "policy_ref": "policy:fixture",
  "parameters": {
    "targets": {
      "kind": "set",
      "items": {
        "kind": "entity",
        "name": "lab.vm"
      }
    },
    "network": {
      "kind": "entity",
      "name": "lab.network"
    }
  },
  "limits": {
    "max_steps": 100,
    "max_calls": 20,
    "max_wall_ms": 60000
  },
  "body": [
    {
      "id": "s1",
      "origins": [
        "point:p1"
      ],
      "op": "call",
      "capability": "NetworkSetup.attach",
      "args": {
        "targets": {
          "parameter": "targets"
        },
        "network": {
          "parameter": "network"
        }
      },
      "bind": "attachment"
    }
  ]
}
